{
  "id": "date.prototype.getutcseconds",
  "category": "date_time",
  "summary": "getUTCSeconds reads UTC seconds 0..59 directly from the UTC time value; Invalid Date returns NaN.",
  "source": {
    "pattern": "$date.getUTCSeconds()",
    "requirements": {
      "receiver_has_date_value_internal_slot": true,
      "property_lookup_resolves_builtin": "Date.prototype.getUTCSeconds"
    }
  },
  "target": {
    "kind": "helper",
    "helper": "JsDate.getUTCSeconds",
    "template": "JsDate.getUTCSeconds($date)"
  },
  "strategy": "helper",
  "confidence": "high",
  "semantics": {
    "receiver_mutated": false,
    "invalid_date": "NaN",
    "timezone": "UTC",
    "operation": "SecFromTime"
  },
  "caveats": [],
  "references": [
    "https://tc39.es/ecma262/multipage/numbers-and-dates.html#sec-date-objects",
    "https://developer.mozilla.org/en-US/docs/Web/JavaScript/Reference/Global_Objects/Date"
  ],
  "tests": [
    {
      "name": "valid UTC component",
      "input": "console.log(new Date(Date.UTC(2024,0,1,0,0,37)).getUTCSeconds());",
      "expected_behavior": "prints 37"
    },
    {
      "name": "invalid Date returns NaN",
      "input": "console.log(Number.isNaN(new Date(NaN).getUTCSeconds()));",
      "expected_behavior": "prints true"
    }
  ]
}
