{"id":"operators.comma","category":"operators","summary":"Lower the comma operator by evaluating the left expression for GetValue side effects, discarding it, then evaluating and returning the right value.","source":{"pattern":"$left, $right","requirements":{"expression_context_supports_sequence_lowering":true}},"target":{"kind":"helper","template":"JsOperators.Sequence(() => $left, () => $right)","helper":"JsOperators.Sequence","notes":"The compiler intrinsic must evaluate left and perform GetValue even though its value is discarded, then evaluate right and return GetValue(right)."},"strategy":"helper","confidence":"high","semantics":{"evaluation_order":"left then right","left_value":"discarded after GetValue","result":"right value"},"caveats":["C# has no general comma expression equivalent.","Do not implement with lambdas when await/yield/control-flow capture would alter semantics; statement-level temporaries may be required."],"references":["https://tc39.es/ecma262/2026/multipage/ecmascript-language-expressions.html"],"tests":[{"name":"normal comma returns right","input":"console.log((1, 2));","expected_csharp":"Console.WriteLine(JsOperators.Sequence(() => 1d, () => 2d));","expected_behavior":"prints 2"},{"name":"edge left getter side effect preserved","input":"let n=0; const o={get x(){n++; return 1}}; console.log((o.x, 7), n);","expected_behavior":"prints 7 1"}]}
