{"id":"dom.element.get-elements-by-class-name-live","category":"dom_renderer","summary":"Return a live HTMLCollection of descendant elements containing all requested class tokens.","source":{"pattern":"$root.getElementsByClassName($classNames)","requirements":{"receiver":"Document or Element","builtin_not_overridden":true,"document_mode":"standards","native_dom_tree":true}},"target":{"kind":"helper","template":"NativeDom.GetElementsByClassName($root, $classNames)"},"strategy":"helper","confidence":"high","semantics":{"liveness":true,"scope":"descendants of receiver","matching":"all ASCII-whitespace-separated requested classes","order":"tree order","empty_tokens":"empty/whitespace-only request matches no elements"},"caveats":["Quirks-mode case folding is excluded by the standards-mode requirement; add a separate runtime/native contract if quirks mode must be preserved."],"references":["WHATWG DOM Living Standard § getElementsByClassName"],"tests":[{"name":"requires all classes","input":"document.body.innerHTML='<i class=\"a b\"></i><i class=\"a\"></i>'; console.log(document.getElementsByClassName('a b').length);","expected_behavior":"prints 1"},{"name":"collection updates after mutation","input":"const c=document.getElementsByClassName('x'); const e=document.createElement('i'); document.body.append(e); e.className='x'; console.log(c.length);","expected_behavior":"collection length reflects the new matching element"}]}